date,title,short,opening
2023-05-04T12:52:16+0000,"In The Hague, Zelensky Renews Call to Prosecute Russian War Crimes","As international support for an independent tribunal appears to be growing, the Ukrainian leader called for “true justice” for crimes in the war.","President Volodymyr Zelensky of Ukraine on Thursday redoubled his call for an independent tribunal to investigate and prosecute Russian war crimes, using a speech in The Hague to demand accountability and invoking the trials of Nazis in Nuremberg after World War II."
2023-05-11T23:30:09+0000,"Zelensky, Citing Equipment Gaps, Says It’s Too Soon for Counteroffensive","Ukraine’s president played down the chance of an imminent military move, but the claim was greeted with some skepticism.","KYIV, Ukraine — President Volodymyr Zelensky said Thursday that Ukraine needed more time to begin a counteroffensive against Russia because it does not yet have enough military equipment from its Western backers, though Ukrainian officials had repeatedly described the assault as imminent."
2023-05-13T08:34:24+0000,Zelensky Meets Pope and Meloni in Italy to Bolster Ukraine’s Support,"The Ukrainian president’s talks with the pope and Prime Minister Giorgia Meloni came at a potentially pivotal moment in the war with Russia, as Kyiv’s forces make advances near the key city of Bakhmut.","Weeks after Pope Francis bewildered the Ukrainian government with talk of a secret peace mission, President Volodymyr Zelensky of Ukraine met Francis in the Vatican on Saturday, part of a whirlwind visit to Rome that included talks with Italy’s president and Prime Minister Giorgia Meloni, both of whom offered their full support."
2023-05-14T08:46:09+0000,"Zelensky Visits Germany, Praising Weapons Pledge and Seeking Jets","The Ukrainian president was received with military honors in Berlin, where he thanked Germany’s leaders for standing with his country.","President Volodymyr Zelensky of Ukraine met with Germany’s leaders in Berlin on Sunday, his latest stop on a diplomatic tour aimed at shoring up support among Western allies and pushing for faster deliveries of weapons as a Ukrainian counteroffensive looms in the 15-month war."
2023-05-15T23:00:09+0000,"In European Tour, Zelensky Reaps Billions More in Promised Military Aid","His trips to Britain, Germany, France and Italy demonstrated the shifting political landscape when it comes to supporting Kyiv, as concerns grow about U.S. backing as the presidential election looms.","President Volodymyr Zelensky of Ukraine has been promised billions of dollars in new military aid during a whirlwind tour of European allies that reflects a striking shift in the political landscape, as Europe takes a more central role in arming Ukraine for its anticipated counteroffensive to drive Russia from its territory."
2023-05-19T03:46:24+0000,"With Prospect of F-16s Closer, Zelensky Will Attend the G7 Strengthened",The Ukrainian president’s attendance at the meeting comes after President Biden opened the door to other nations training Ukrainian pilots and sending their F-16s to Kyiv.,"President Volodymyr Zelensky of Ukraine will attend the Group of 7 summit in Hiroshima, Japan, this weekend, to seek further commitments for more arms and aid from the world’s wealthiest democracies. "
2023-05-19T10:04:31+0000,Zelensky Urges Arab Leaders Not to ‘Turn a Blind Eye’ to Russian Aggression,"Addressing an Arab League summit in Saudi Arabia, President Volodymyr Zelensky of Ukraine urged Arab nations to stand with him against Russia and called out their reluctance to take sides in the war.","President Volodymyr Zelensky of Ukraine implored Arab leaders meeting in Saudi Arabia on Friday not to bend to Russian influence, as he continued a diplomatic tour to build international support ahead of a widely anticipated Ukrainian counteroffensive."
2023-05-19T16:27:48+0000,Zelensky Appeals to Arab Leaders for Help Resisting Russia’s Invasion,President Volodymyr Zelensky of Ukraine called for help freeing Ukrainians held in Russian prisons during an address to the Arab League summit.,President Volodymyr Zelensky of Ukraine called for help freeing Ukrainians held in Russian prisons during an address to the Arab League summit.
2023-05-20T15:39:24+0000,"After a Show-Stopping Entrance at the G7, Zelensky Pleads for More Aid",He urged his supporters to stay the course and tried to convince fence sitters like India and Brazil that there is no middle ground.,President Volodymyr Zelensky of Ukraine landed in Japan on Saturday determined to urge the wealthiest democracies in the world to stick with him as Moscow bets on the West growing fatigued by the cost and consequences of the war.
2023-05-21T16:43:00+0000,Images of a Ruined Hiroshima Remind Zelensky of Present-Day Bakhmut,"While it “wouldn’t be fair” to compare Hiroshima to what is happening in his country, Ukraine’s president said the city’s atomic bomb museum offered grim echoes of fresh devastation.","President Volodymyr Zelensky of Ukraine wrapped up his appearance at the Group of 7 summit in Japan with a visit to Hiroshima’s atomic bomb museum, saying on Sunday that he saw echoes of his own country’s pain in images of the 1945 devastation."
2023-05-22T06:18:35+0000,Zelensky wraps up another fruitful trip and Russia claims a big win in Ukraine.,"President Volodymyr Zelensky of Ukraine grabbed the spotlight at the Group of 7 summit in Japan and won even more pledges for military aid, including training for Ukraine’s pilots on F-16 fighter jets. But at home this week he faces questions about the future of the eastern city of Bakhmut, the deadliest battle of the war.","President Volodymyr Zelensky of Ukraine grabbed the spotlight at the Group of 7 summit in Japan and won even more pledges for military aid, including training for Ukraine’s pilots on F-16 fighter jets. But at home this week he faces questions about the future of the eastern city of Bakhmut, the deadliest battle of the war."
2024-07-11T23:59:08+0000,Biden Mixes Up Kamala Harris and Donald Trump After Doing the Same With Zelensky and Putin,The gaffe referring to his own running mate as “Vice President Trump” during a closely watched news conference came shortly after he introduced the president of Ukraine as “President Putin.”,"President Biden referred to Vice President Kamala Harris as “Vice President Trump,” flubbing his response to the first question posed to him in a much-awaited news conference during a summit of NATO leaders."
2024-07-19T11:32:10+0000,Zelensky Becomes First Foreign Leader to Visit U.K. Cabinet Since Clinton,President Volodymyr Zelensky briefed Keir Starmer’s top team in an appearance designed to showcase Britain’s steadfast support for Ukraine in its war against Russia.,"Ukraine’s president, Volodymyr Zelensky, became the first foreign leader to attend Britain’s cabinet meeting in person since former U.S. president Bill Clinton in 1997, in a public display of Britain’s staunch support for Ukraine as doubts grow about future U.S. military aid if Donald J. Trump wins a second presidential term."
2024-07-20T12:19:32+0000,Trump and Zelensky Speak by Phone as Ukraine Worries About U.S. Backing,Kyiv ponders what another Trump administration would mean for its war initiatives.,"Former President Donald J. Trump and Ukraine’s president, Volodymyr Zelensky, spoke over the phone late this week amid mounting concern in Kyiv that a second Trump administration would spell the end of American support in Ukraine’s fight against Russia."
2025-03-01T00:18:14+0000,Europe Rallies Around Zelensky After Explosive White House Meeting,"The statements piled up on social media, offering words of encouragement to the Ukrainian leader and his people.","European leaders quickly pledged their continued support for Ukraine on Friday after President Trump’s blistering criticism of Ukraine’s president, Volodymyr Zelensky, in a meeting at the White House."
2025-03-01T01:04:54+0000,‘This Is Going to Be Great Television’: Trump Sums Up His Zelensky Showdown,The ratings are never far from President Trump’s mind.,One of the most surreal moments of Friday’s Oval Office showdown between President Trump and President Volodymyr Zelensky of Ukraine came at the very end.
2025-03-01T04:08:56+0000,"In Showdown With Zelensky, Trump Takes Offense on Putin’s Behalf","Never in the past few decades at least has an American president engaged in such an angry, scathing attack on a visiting foreign leader in the Oval Office.","It went well enough for the first 23 minutes, a polite if stiff meeting between an American president and a foreign leader. Then their differences started to be aired, unmistakably though not too contentiously. Then after 39 minutes, it really came off the rails."
2025-03-01T14:30:16+0000,Trump’s Dressing Down of Zelensky Plays Into Putin’s War Aims,The public blowup could propel President Vladimir V. Putin of Russia to escalate the fight in Ukraine instead of agreeing to peace.,"President Trump says he wants a quick cease-fire in Ukraine. But President Vladimir V. Putin of Russia appears to be in no rush, and the blowup on Friday between Mr. Trump and Ukraine’s president may give Russia’s leader the kind of ammunition he needs to prolong the fight."
2025-03-01T14:52:46+0000,"Shocked by Trump, Zelensky and Ukraine Try to Forge a Path Forward","After President Trump’s rebukes, President Volodymyr Zelensky tried to repair the relationship with his counterpart while also reaching out to European allies.","For months leading into the American elections last fall, the prospect of a second Trump presidency deepened uncertainty among Ukrainians over how enduring American support would prove in a war threatening their national survival."
2025-03-01T16:54:35+0000,How Zelensky’s Oval Office Meeting Turned into a Showdown With Trump,The question hovering over Washington was whether the confrontation was a spontaneous outburst or a planned verbal smack down.,"Just hours before President Volodymyr Zelensky of Ukraine sat down with President Trump in the Oval Office on Friday, Senator Lindsey Graham of South Carolina dispensed some advice to the Ukrainian leader."
2025-03-01T17:44:11+0000,Trump Berates Zelensky and Putin Benefits,"The United States’ relationship with Ukraine erupted in a storm of acrimony on Friday as President Trump and Vice President JD Vance berated President Volodymyr Zelensky of Ukraine in an explosive televised Oval Office showdown and abruptly cut short a visit meant to coordinate a plan for peace. Erica Green, a White House correspondent for The New York Times, breaks it down.","The United States’ relationship with Ukraine erupted in a storm of acrimony on Friday as President Trump and Vice President JD Vance berated President Volodymyr Zelensky of Ukraine in an explosive televised Oval Office showdown and abruptly cut short a visit meant to coordinate a plan for peace. Erica Green, a White House correspondent for The New York Times, breaks it down."
2025-03-01T21:37:50+0000,‘Why Don’t You Wear a Suit?’: A Right-Wing News Outlet With Coveted Access Questions Zelensky,"After the White House began to handpick pool reporters, Brian Glenn of the conservative Real America’s Voice network got to be front and center for the Ukrainian president’s visit.","A voice from the press section joined the chorus of people demanding answers from President Volodymyr Zelensky of Ukraine on Friday, during a meeting with President Trump and his associates."
2025-03-02T14:03:20+0000,‘S.N.L.’ Reprises the Trump-Zelensky Oval Office Face-Off,"Mike Myers, as Elon Musk, adds an extra measure of crazy to an already bizarre moment in MAGA-era foreign policy.",A shockingly combative White House meeting between President Trump and President Volodymyr Zelensky of Ukraine may have precipitated a diplomatic crisis and signaled a fissure in the longstanding relationship between the United States and Europe. But the incident provided ample grist for the satirical mill on “Saturday Night Live” in the first new broadcast after its 50th anniversary celebration.
2025-03-02T19:19:32+0000,"Rubio Attacks Zelensky, Firmly Defending Trump and Vance","Facing a wave of criticism from his former Senate colleagues, Secretary of State Marco Rubio backed the complaints lobbed by President Trump and Vice President JD Vance against Ukraine’s leader.","Secretary of State Marco Rubio on Sunday fiercely defended President Trump’s sharp turn against Ukraine’s leader, accusing President Volodymyr Zelensky of trying to derail the peace process with Russia by openly challenging Mr. Trump and Vice President JD Vance in a heated televised exchange from the Oval Office."
2025-03-03T11:00:09+0000,The Fallout From Zelensky and Trump’s Oval Office Meltdown,"A clash between presidents, and its consequences.","On Friday, President Trump and Vice President JD Vance berated President Volodymyr Zelensky of Ukraine in an explosive televised Oval Office meeting and abruptly cut short a visit that was meant to help coordinate a plan for peace."
2025-03-03T15:59:47+0000,Zelensky Turns to Diplomacy in a War With ‘a Long Way to Go’,"After a startling clash with President Trump, who has echoed the Kremlin view of the war, Ukraine’s leader is trying to shore up European support and smooth over relations with Washington.","President Volodymyr Zelensky returned to Ukraine on Monday after a whirlwind diplomatic mission that included both humiliation, by President Trump, and a warm embrace, from European leaders. He vowed to use all diplomatic avenues to pursue an end to Ukraine’s war with Russia, but acknowledged there was “a long way to go.”"
2025-03-04T08:17:35+0000,Late Night Recaps Zelensky’s Casual Friday at the White House,"“I don’t see you asking Elon Musk if he owns a suit,” Seth Meyers said of the reporter who questioned Ukraine’s president about his attire.","Welcome to Best of Late Night, a rundown of the previous night’s highlights that lets you sleep — and lets us get paid to watch comedy. Here are the 50 best movies on Netflix right now."
2025-03-04T11:43:10+0000,"Zelensky Offers Terms to Stop Fighting, Assuring U.S. That Ukraine Wants Peace","“We are working on all possible scenarios to protect Ukraine,” said President Volodymyr Zelensky, whose country was looking to European allies for support.","President Volodymyr Zelensky of Ukraine on Tuesday offered a course of action that he said could end the war, while trying to assure the Trump administration that his government was dedicated to peace."
2025-03-05T04:59:00+0000,Quote of the Day: Zelensky Tries To Make Peace On Every Front,"Quotation of the Day for Wednesday, March 5, 2025.","“It was a kind of Pearl Harbor, a political Pearl Harbor, for us.”"
2025-03-05T15:28:12+0000,"After Days of Coaching, Zelensky Seeks a Path to Trump’s Good Graces",Prime Minister Keir Starmer of Britain and President Emmanuel Macron of France have been prodding and counseling Volodymyr Zelensky on how to deal with President Trump.,"The tutelage began last Friday, soon after President Volodymyr Zelensky of Ukraine suffered through a humiliating dressing down at the White House, courtesy of President Trump. "
2025-03-06T09:17:43+0000,Missile Strikes Hotel in Zelensky’s Hometown in Ukraine,"At least four people were killed in a Russian attack, Ukraine said, amid concerns about air defenses after the U.S. said it was suspending military and intelligence aid.","A Russian missile slammed into a hotel late Wednesday in the hometown of President Volodymyr Zelensky of Ukraine, killing at least four people and injuring more than 30 others, the Ukrainian authorities said."
2025-03-06T21:19:23+0000,Russian Missile Strikes Hotel in Zelensky’s Hometown,Residents and aid workers said they received warnings only a few minutes before a missile struck a hotel in the hometown of President Volodymyr Zelensky in central Ukraine.,Residents and aid workers said they received warnings only a few minutes before a missile struck a hotel in the hometown of President Volodymyr Zelensky in central Ukraine.
2025-03-10T09:27:27+0000,Zelensky Meets With Saudi Crown Prince Before U.S.-Ukraine Talks,The prince wants Saudi Arabia to be a middleman in peace talks. Ukraine’s leader said they’d discussed “steps and conditions needed to end the war.”,"President Volodymyr Zelensky of Ukraine, working to repair his strained relationship with the United States and secure a favorable deal to end the war with Russia, met on Monday with Crown Prince Mohammed bin Salman in Saudi Arabia."
2025-03-10T14:00:14+0000,Trump’s Attacks Give Zelensky a Bit of a Reprieve at Home,"The Ukrainian leader’s approval rating is rising, and critics have backed off after he was humiliated and criticized by President Trump, who has also demanded new elections in Ukraine.","President Volodymyr Zelensky of Ukraine was losing popularity at home for months, seen by many as a thin-skinned leader who had concentrated power around him. Political opponents saw an opening to win a future election against him. His former top general in the war against Russia had a higher approval rating."
2025-03-12T12:05:50+0000,Zelensky Says Ukraine Showed ‘We Want a Fast Peace’,"While Ukraine said it would agree to a 30-day cease-fire proposal, many in the country were skeptical about whether Russia would do the same.","After hours of negotiations that ended with Ukrainian officials acquiescing to a proposed 30-day cease-fire with Russia, it was not until the flight home that they received the news they most wanted to hear: American military assistance was flowing again."
2025-03-13T20:18:27+0000,Trump Sees ‘Good Signals’ on Russia-Ukraine Cease-Fire. Zelensky Does Not.,"U.S. officials were in Moscow for talks, and the Russian leader said he was open to a cease-fire, but President Volodymyr Zelensky of Ukraine expressed skepticism.","President Trump said Thursday he saw “good signals” toward finalizing a 30-day cease-fire agreement between Russia and Ukraine, as U.S. officials visiting Moscow were expected to meet with President Vladimir V. Putin of Russia."
2025-03-14T05:00:05+0000,What Zelensky Does Next,"Different sides of the war in Ukraine reach for different, simple narratives about Mr. Zelensky. The truth has always been more complicated.","My most vivid memory of Volodymyr Zelensky’s campaign for president of Ukraine was his debate with President Petro Poroshenko in April 2019. Mr. Poroshenko, a tycoon who made his fortune in chocolate, talked patriotically about the army, language and faith. Mr. Zelensky, a hugely popular comedian and actor who played a fictional president on TV, shot back that he was an outsider ready to break the system. His gruff energy and charisma easily outshined Mr. Poroshenko. Days later, the presidency was his."
2025-03-15T11:17:54+0000,Zelensky Accuses Russia of Trying to Trap Ukraine’s Forces Amid Cease-Fire Talks,"The Kremlin is pressing an offensive to take back its land in the Kursk region, while prolonging negotiations over a proposal by Washington and Kyiv.","President Volodymyr Zelensky of Ukraine on Saturday accused President Vladimir V. Putin of Russia of trying to surround Kyiv’s forces in Russia’s Kursk region to improve his position amid cease-fire talks with Washington, but said that Ukraine’s forces had not been trapped.  "
2025-03-19T12:42:40+0000,Zelensky Agrees to Halt Strikes on Russian Energy Targets in Call With Trump,"President Trump also floated the idea of the United States taking control of Ukrainian power plants, according to U.S. officials. The Ukrainian president said he was not pressured about the proposal.",President Volodymyr Zelensky of Ukraine agreed in a Wednesday phone call with President Trump to accept Russia’s offer of a mutual pause in attacks on energy targets for 30 days as a step toward a broader cease-fire.
2022-02-08T11:35:34+0000,"Macron meets Zelensky in Ukraine, as Russia keeps the world guessing.","KYIV, Ukraine — President Emmanuel Macron of France said on Tuesday that the Ukraine crisis could take months to resolve, but that his shuttle diplomacy this week between Russia and Ukraine had raised hopes of stabilizing the situation.","KYIV, Ukraine — President Emmanuel Macron of France said on Tuesday that the Ukraine crisis could take months to resolve, but that his shuttle diplomacy this week between Russia and Ukraine had raised hopes of stabilizing the situation."
2022-02-19T08:01:59+0000,President Zelensky asks the West to make no deals ‘behind our back’ as the threat to Ukraine grows.,"MUNICH — As shelling hammered towns in eastern Ukraine on Saturday and civilians boarded buses to evacuate the region, Russia engaged in a dramatic display of military theater, test-firing ballistic and cruise missiles in a reminder to the West that a conflict over Ukraine could quickly escalate.","MUNICH — As shelling hammered towns in eastern Ukraine on Saturday and civilians boarded buses to evacuate the region, Russia engaged in a dramatic display of military theater, test-firing ballistic and cruise missiles in a reminder to the West that a conflict over Ukraine could quickly escalate."
2022-02-19T09:44:25+0000,"Zelensky leaves Ukraine, heading to Munich to rally Western support.","President Volodymyr Zelensky of Ukraine chose not to cancel his scheduled trip out of the country Saturday to attend a security conference in Munich, even as warnings from the West about a Russian invasion of his country grew increasingly urgent.","President Volodymyr Zelensky of Ukraine chose not to cancel his scheduled trip out of the country Saturday to attend a security conference in Munich, even as warnings from the West about a Russian invasion of his country grew increasingly urgent."
2022-02-19T17:32:27+0000,President Zelensky criticizes the allied response to Russia’s buildup.,The Ukrainian leader thanked the West but said sanctions should be applied now and that repeated predictions of imminent war were damaging.,"MUNICH — In an appeal that was at times bitterly critical of the West, President Volodymyr Zelensky of Ukraine urged allies on Saturday to begin imposing sanctions on Russia now rather than wait for an invasion, and he took aim at repeated American declarations that an attack would happen within days."
2022-02-24T06:50:47+0000,Zelensky Declares Martial Law in Ukraine,"In a televised address to the nation, President Volodymyr Zelensky of Ukraine declared martial law, but did not say what restrictions would be in place.","In a televised address to the nation, President Volodymyr Zelensky of Ukraine declared martial law, but did not say what restrictions would be in place."
2022-02-24T15:58:32+0000,Zelensky Steps Into a Role Few Expected: Ukraine’s Wartime President,"Even as doubts have lingered about his preparedness to lead, Volodymyr Zelensky, a former actor, gave the performance of his life as Russian forces prepared to invade.","KYIV, Ukraine — He appeared on Ukrainian television early on Thursday morning, as the threat of war was pressing down. First, President Volodymyr Zelensky of Ukraine addressed the 44 million citizens of Ukraine. Then he turned to the 144 million Russians living next door and beseeched them to prevent an attack that evoked the darkest eras in Europe since World War II."
2022-02-25T00:30:19+0000,Zelensky says Russian saboteurs are in Kyiv and he is Moscow’s prime target.,"Ukraine’s president, Volodymyr Zelensky, said that Russian saboteurs had entered Kyiv, the capital, and that he was “target No. 1” for Russian forces, followed by his family.","Ukraine’s president, Volodymyr Zelensky, said that Russian saboteurs had entered Kyiv, the capital, and that he was “target No. 1” for Russian forces, followed by his family."
2022-02-25T23:55:36+0000,"In Video, a Defiant Zelensky Says, ‘We Are Here’","The 44-year-old president of Ukraine videotaped himself in Kyiv as Russian forces closed in on the capital, vowing to fight them to the end.","KYIV, Ukraine — As Russian missiles bombarded the Ukrainian capital Kyiv on Friday, President Volodymyr Zelensky seemed to go missing. Italy’s prime minister even told his own parliament, in a tremulous voice, that Mr. Zelensky had missed a planned call with him."
2022-02-27T18:03:22+0000,"How Volodymyr Zelensky rallied Ukrainians, and the world, against Putin.","Mr. Zelensky’s decision to remain in the capital, Kyiv, while it’s under Russian attack has moved many.","Before Russia invaded Ukraine, President Volodymyr Zelensky was often derided as a comic turned unlikely politician. But with the help of social media, he has become the leader Ukraine did not know it needed."
2022-02-28T13:05:46+0000,"Zelensky, in a passionate speech, urges the E.U. to admit Ukraine immediately.",President Volodymyr Zelensky of Ukraine urged the European Union on Monday to grant his country immediate accession to the bloc in response to Russia’s invasion.,President Volodymyr Zelensky of Ukraine urged the European Union on Monday to grant his country immediate accession to the bloc in response to Russia’s invasion.
2023-06-01T10:42:27+0000,Zelensky pushes for E.U. and NATO membership at a meeting of European leaders in Moldova.,"“This year is for decisions,” President Volodymyr Zelensky of Ukraine said at the European Political Community gathering, which sought to showcase Western solidarity amid the Kremlin’s war.","NATO should decide this year whether to admit Ukraine as a member, President Volodymyr Zelensky of Ukraine said on Thursday, intensifying his case, at a summit of European leaders in Moldova, for the country’s accession to the alliance."
