date,title,short_opening
2024-02-16,Zelensky Visits Berlin and Paris to Shore Up Support as U.S. Wavers,The Ukrainian president signed security agreements and sought to push the European leaders to bolster aid as concerns over American funding grow.
2024-02-17,"‘Dictators Do Not Go on Vacation,’ Zelensky Warns Washington and Europe","President Volodymyr Zelensky pushed back against skepticism of a Ukraine victory, calling on world leaders not to ask when the war would end, but why Russia was still able to wage it."
2024-02-25,"31,000 Ukrainian Soldiers Killed in Two Years of War, Zelensky Says","The tally that President Volodymyr Zelensky revealed on Sunday differs sharply from that given by U.S. officials, who have said the number is closer to 70,000."
2024-03-03,Russian Strike’s Toll Rises to 12 as Zelensky Blames Air Defense Delay,"President Volodymyr Zelensky did not refer to the United States, but his words appeared to reflect frustration over a stalled American aid package."
2024-03-06,Russia Strikes Odesa With Missile During Visit by Zelensky and Greek Leader,"Neither man was hurt, and it was unclear whether the Russian Army was targeting them."
2024-03-07,Zelensky Names Ukraine’s Ex-Top General Ambassador to U.K.,"The former top general, Valery Zaluzhny, was dismissed last month amid tensions with the civilian leadership. He has been a very popular figure in Ukraine."
2023-01-11,Zelensky thanks the ‘free world’ in a video message at the Golden Globes.,"“There will be no third world war,” the Ukrainian president said. “It is not a trilogy. Ukraine will stop the Russian aggression on our land.”"
2023-01-16,A Zelensky adviser says he will resign after outrage over comments on the Dnipro strike.,"In televised comments after a devastating Russian strike in Dnipro on Saturday, the adviser, Oleksii Arestovych, said that the missile had been struck by Ukraine’s air defense system before crashing into an apartment building. He later apologized."
2023-01-17,Zelensky pushes allies to move faster with aid as fears grow of a new Russian offensive.,President Volodymyr Zelensky praised the British announcement of a new military aid package and urged other allies to move faster to match that support as Ukraine warns that Russia could be preparing a renewed push to capture more territory.
2023-01-18,Zelensky will address the Davos gathering in a marathon week of diplomacy.,"A critical week of diplomacy for Ukraine ramps up on Wednesday, when President Volodymyr Zelensky is scheduled to address the World Economic Forum in Davos, Switzerland, as Ukraine redoubles its pleas for more advanced weapons."
2023-01-18,"‘Tragedies are outpacing life’: In a video address at Davos, Zelensky mourns the dead and pleads for help.","At the start of his address, the Ukrainian president called for a minute of silence to honor the country’s minister of internal affairs."
2023-01-19,C.I.A. Director Visited Kyiv for Meeting With Zelensky,"The director, William J. Burns, has made periodic visits to Ukraine to meet with intelligence officials and to exchange information with the country’s president."
2023-01-22,Zelensky Urges Ukrainians to Remain Unified,"On a day meant to mark the unification of Ukraine in 1919, the country’s leader said it was vital for Ukrainians of all regions to bind together."
2023-01-23,Zelensky vows action against corruption after a minister is fired for embezzlement.,The Ukrainian leader said the dismissal should serve as notice to officials whose actions “violate the principle of justice.”
2023-01-31,Quotation of the Day: Zelensky Presses Allies for Arms on Wish List,"Quotation of the Day for Tuesday, January 31, 2023."
2022-05-01,Zelensky says around 100 civilians are being evacuated from the Mariupol steel factory.,The Ukrainian president said that civilians were being evacuated from the Azovstal steel factory and are headed to a “controlled area.”
2022-05-08,Zelensky’s Wife Thanks Jill Biden for ‘Courageous’ Trip to Ukraine,"In an unannounced trip to Ukraine, Dr. Jill Biden, the first lady, met with Ukraine’s first lady, Olena Zelenska, in a town a few miles away from the border with Slovakia."
2022-05-09,A bomb-sniffing dog named Patron received state honors from Zelensky.,"Patron has found more than 200 explosives, President Zelensky said. The dog has gone viral as Ukraine wages an information war."
2022-05-13,Courage Seemed to Be Dead. Then Came Zelensky.,Can economics make sense of heroism?
2022-05-17,"‘The hate of men will pass, and dictators die’: Zelensky quotes Chaplin in an address to Cannes.","The Ukrainian leader’s appearance at the international film festival followed similar addresses to Parliaments around the world, including Congress in March."
2022-05-23,"Addressing Davos, Zelensky invites global businesses to Ukraine.","The Ukrainian leader pledged to root out corruption to make his country more attractive to investors, and urged for tougher penalties against Moscow."
2022-05-23,Zelensky says Russian forces killed 87 people in an attack.,"The attack took place last week in the Chernihiv region north of the capital, Kyiv."
2022-05-23,Zelensky Invites Global Companies Leaving Russia to Open In Ukraine,"Addressing the World Economic Forum, President Volodymyr Zelensky of Ukraine called for tougher sanctions against Russia and encouraged international companies shunning Russia to move into Ukraine."
2022-05-23,Zelensky Urges Even Harder Line on Russia as Allies Work to Remain United,"A midlevel Russian diplomat broke ranks and resigned with a scathing statement on the war, and President Volodymyr Zelensky called on world leaders to turn up the pressure."
2022-05-24,"Quotation of the Day: Zelensky Urges Global Leaders to Maintain a Tough, United Front","Quotation of the Day for Tuesday, May 24, 2022"
2024-11-06,Zelensky Urges Trump to Help Defend Ukraine Against Russia,"President-elect Donald J. Trump has often shown disdain toward Ukraine and its leader, President Volodymyr Zelensky."
2024-11-08,Trump Put Musk on Phone With Zelensky During Call,Elon Musk was with Donald Trump at Mar-a-Lago when the president-elect spoke with Ukraine’s leader. It is not clear if they discussed any change in U.S. policy toward Ukraine.
2022-09-01,Zelensky says Russia prevented independent journalists from observing the I.A.E.A. mission.,President Volodymyr Zelensky of Ukraine hailed the arrival of United Nations inspectors at the occupied Zaporizhzhia Nuclear Plant on Thursday but said Russia was undermining the inspection by preventing independent journalists from observing it and by intimidating residents in the surrounding town.
2022-09-14,"Zelensky Visits a City Just Miles From the Front, Underscoring Ukraine’s Gains",President Volodymyr Zelensky’s trip to a city reclaimed days ago demonstrated Ukraine’s growing boldness in the wake of Russia’s frantic retreat from the country’s northeast.
2022-09-15,Zelensky is involved in a car accident in Ukraine’s capital but isn’t seriously hurt.,Ukraine’s president did not mention the accident during his nightly address.
2022-09-15,The E.U.’s top official meets with Zelensky.,"Ursula von der Leyen, the European Union’s top official, reassured President Volodymyr Zelensky of Ukraine during a wide-ranging meeting Thursday in Kyiv that his country is still progressing toward membership in the bloc."
2022-09-19,Zelensky Meets With BlackRock Chief to Discuss Reconstruction Fund,The world’s largest asset manager advised Ukraine on how to revive the country’s shattered economy by attracting public and private investment.
2022-09-21,"In a Defiant Address, Zelensky Says, ‘Russia Should Pay for This War’","“A crime has been committed against Ukraine, and we demand just punishment,” President Volodymyr Zelensky of Ukraine said in a recorded speech to the U.N. General Assembly."
2022-09-23,Zelensky Asks Businesses to Join a ‘Marshall Plan’ for Ukraine,Ukraine estimates it would cost $750 billion to rebuild the war-battered country.
2022-09-24,Zelensky tells Ukrainians living under occupation to avoid conscription ‘by any means.’,"With Russia laying the groundwork to formally annex areas it is occupying, President Volodymyr Zelensky of Ukraine directly asked Ukrainians to help the nation’s war effort even from within the occupied territory."
2022-09-25,Zelensky calls on Russians to resist Putin’s conscription.,"President Volodymyr Zelensky of Ukraine encouraged Russians to resist their country’s conscription drive on Saturday, his latest effort to blunt President Vladimir V. Putin’s attempts to broaden the war."
2022-09-25,Zelensky urges allies to step up pressure on Putin amid ‘nuclear blackmail.’,President Volodymyr Zelensky of Ukraine warned on Sunday that President Vladimir V. Putin’s threat to use nuclear weapons in Russia’s war against Ukraine was no bluff as he urged the United States and other Western allies to intensify the pressure on the Russian leader as his troops falter on the battlefield.
2022-09-27,"At the United Nations, Zelensky rails against Russia for trying to ‘steal’ Ukrainian territory.","With Russia appearing poised to annex parts of eastern and southern Ukraine, President Volodymyr Zelensky of Ukraine lashed out at the Kremlin on Tuesday, telling the United Nations Security Council that Moscow was staging “sham” referendums at gunpoint as a prelude to stealing part of his country."
2022-09-29,Zelensky’s Answer to Escalating Russian Threats: Defiance,"In a nightly address, President Volodymyr Zelensky of Ukraine told Russian soldiers: “If you want to live, run.”"
