date,title,short_opening
2024-08-04,"Ukraine Has Received F-16 Fighter Jets, Zelensky Says",President Volodymyr Zelensky did not say whether the jets had already flown combat missions. A shortage of trained pilots and a limited number of jets will constrain their immediate impact.
2024-08-15,"Ukraine Captures Russian Town, Zelensky Says","The fall of Sudzha, about six miles from the border, would be Ukraine’s first capture of a Russian town since its troops crossed into Russian territory 10 days ago."
2024-08-20,Zelensky Says Push Into Russia Shows the West’s Red Lines Are ‘Naïve’,President Volodymyr Zelensky of Ukraine seized on the incursion’s success to press allies to lift a longtime restriction: the use of Western-supplied long-range weapons against Russia.
2024-08-24,"On Ukraine’s Independence Day, Zelensky Celebrates Push Into Russia","Although the cross-border offensive carries risks, it also paid dividends on Saturday with the first prisoner swap with Russia in several months."
2024-08-30,Zelensky Dismisses the Head of the Air Force Days After F-16 Crash,"The Ukrainian president gave no reason, but there are indications that friendly fire may have brought down the jet, a Western official said."
2023-12-10,Zelensky to Visit Washington With U.S. Aid to Ukraine in Doubt,Officials announced that the Ukrainian president would travel to Washington on Tuesday for a last-ditch lobbying effort with President Biden and members of Congress.
2023-12-11,"As Zelensky Heads to Washington, Russia Targets Kyiv With Missiles",The Ukrainian leader will be appealing for more military support from the United States as an emboldened Russia steps up its attacks on his country.
2023-12-12,"Zelensky Begins Aid Push in Washington, Casting Inaction as Win for Putin",The Ukrainian president plans to meet with President Biden and lawmakers on Tuesday as chances of an aid deal in Congress have become increasingly bleak.
2023-12-12,"Zelensky in Washington, and a Texas Abortion Case Ruling",Hear the news in five minutes.
2023-12-12,"Republicans Sideline Zelensky With Border Demands, Imperiling Aid Package","The Ukrainian president delivered an urgent plea for more help for his country in its fight against Russia, only to be told by Republicans that his challenges were not their focus."
2023-12-12,"In Washington, Zelensky Faces Republican Intransigence","Also, Biden and Netanyahu disagree over the war’s next steps. Here’s the latest at the end of Tuesday."
2023-12-15,Zelensky Returns to Ukraine With Little Aid and a Raft of Needs,"The European Union’s willingness to open accession talks will lift morale, but the more immediate prospects for financial support from allies is sobering."
2023-12-19,"Zelensky, After Tough Year on Battlefield, Insists Ukraine Will Prevail","Ukraine’s counteroffensive sputtered, but President Volodymyr Zelensky argued that Russia, too, “failed to achieve any results” on the ground, while Ukraine had successes at sea."
2024-09-04,"N.Y. Official Accused of Aiding China, and Zelensky Plans Cabinet Shake-Up","Plus, robot taxis — with human helpers."
2024-09-06,"Meeting With Allies, Zelensky Presses for More Weapons","The Ukrainian leader argued that escalating military pressure on Russia, combined with diplomacy, was the best way to motivate Moscow to seek peace."
2024-09-24,Zelensky Prepares for Tough Act Putting Ukraine War Back on Global Agenda,"In his speech to the U.N. General Assembly on Wednesday and then a meeting with President Biden a day later, the Ukrainian president will be pleading for more military and political support."
2024-09-24,Zelensky Says Western Allies Must Allow Ukrainian Strikes Deep Into Russia,"The leaders of Ukraine and Denmark said in a joint interview that allied nations must lift restrictions on arms, increase their production and help Ukraine build weapons inside the country."
2024-09-24,"Zelensky Addresses the Security Council, Calling for Attention to Stay on Ukraine",“Russia can only be forced into peace.” President Volodymyr Zelensky of Ukraine urged the Council members to sustain their backing for his country’s resistance to Russia’s full-scale invasion.
2024-09-25,What Is Zelensky’s ‘Victory Plan’ for Ukraine’s War With Russia?,The Ukrainian leader aims to present President Biden with a strategy to improve his country’s position ahead of any peace negotiations with Russia.
2024-09-25,Zelensky Warns U.N. Against Conceding to Russia’s ‘Insane’ Desire for Land,"President Volodymyr Zelensky of Ukraine told the meeting of world leaders that capitulating to Russia would only give its president, Vladimir Putin, the “political space to continue the war.”"
2024-09-26,Zelensky Pleads for More U.S. Weapons in Meetings With Biden and Harris,"The stakes are high for the Ukrainian leader, who is trying to fend off Russia’s invasion while also navigating tricky U.S. politics that could determine future of American aid."
2024-09-26,"Harris Meets With Zelensky, Anticipating a Handover of Global Crises",The meeting signaled that the White House was preparing her to take over a thorny diplomatic relationship should she win the election in November.
2024-09-26,Zelensky’s Star Power Fades on Capitol Hill,"As the war drags on, Ukraine’s president receives a quieter welcome in Washington and faces angry questions from some Republicans."
2024-09-27,Zelensky Meets Trump Amid Fears for Continued U.S. Support for Ukraine,The session in New York was part of a nearly weeklong U.S. visit by the Ukrainian president in which he has made appeals to both Democrats and Republicans.
2024-09-27,"On Trip to U.S., Zelensky Finds Ukraine’s Fortunes Tied to the Election",A whirlwind week of top-level meetings failed to alleviate concerns in Kyiv that a Trump presidency could lead to a dramatic shift in American policy.
2024-09-27,"Trump Suggests Putin Wants to End War, as Zelensky Looks On","“I’m sure President Putin wants it to stop,” Donald Trump said of the Russia-Ukraine war on Friday. President Volodymyr Zelensky of Ukraine stressed that the war shouldn’t have been started."
2024-09-30,"After U.S. Trip, Zelensky Returns to an Enduring War","Cities across Ukraine have suffered airstrikes in recent days, and Moscow is pressing a slow advance in the east. Kyiv has hit back against arms depots, trying to disrupt Russian logistics."
2022-12-03,Zelensky Proposes Barring Orthodox Church That Answers to Moscow,"Ukraine’s president called for legislation to prevent an ancient branch of the Orthodox Church, led by a Putin ally, from operating in his country, but it remains unclear how that would work."
2022-12-07,Zelensky is named Time’s person of the year.,Ukraine’s president was propelled onto the world stage with Russia’s invasion of his country.
2022-12-14,Zelensky urges the E.U. to create a war tribunal as he accepts the Sakharov Prize.,Ukraine’s president made the remarks as he accepted the union’s top human rights award on behalf of his people.
2022-12-14,Zelensky says Russian and Belarusian athletes shouldn’t be allowed at the 2024 Olympics.,"In recent days, international Olympic officials have been unclear about whether the athletes will be allowed to compete in the Paris Summer Olympics."
2022-12-20,Zelensky’s visit to Bakhmut aims to show Ukraine’s resolve.,"Despite months of Russian bombardments and waves of assaults, the city has remained in Ukrainian control."
2022-12-20,"Lauding Their Soldiers, Putin and Zelensky Signal Long Fight Ahead","As the 10-month mark of the war nears, the leaders of Ukraine and Russia handed out medals and pledged not to back down."
2022-12-20,Your Wednesday Briefing: Zelensky Visits Bakhmut,"Also, Japan’s central bank eases its policy and Fiji prepares for a leadership change."
2022-12-21,"Zelensky Will Meet With Biden in Washington and Address Congress, Officials Say",The visit will be the first time President Volodymyr Zelensky of Ukraine has left his country since Russia invaded in February.
2022-12-21,Your Thursday Briefing: Zelensky at the White House,"Also, Donald Trump’s tax returns show losses during his presidency."
2022-12-21,Zelensky’s Message: Ukraine Is Fighting for Good Over Evil,One of the Ukrainian leader’s overriding aims is to prevent support for the war from becoming a partisan issue.
2022-12-22,"U.S. Aid Is ‘Not Charity,’ Zelensky Tells Congress as a Lengthy War Looms",President Volodymyr Zelensky described military assistance for Ukraine as an investment in global security and democracy in the face of Russian aggression.
2022-12-22,Full Transcript of Zelensky’s Speech Before Congress,"The Ukrainian president delivered an emotional appeal for further American support, vowing that his country would prevail in its war with Russia."
2022-12-22,"For Zelensky, a Celebration of Resilience and a Sales Pitch for Support","For all the talk of victory, President Volodymyr Zelensky’s remarks in Washington revealed hints about his worries for the year ahead."
2022-12-22,Zelensky’s Appeal for More U.S. Support,Readers praise his resolve and urge America to do more to help Ukraine. Also: Gene editing; Israel’s future; our carbon footprint. 
2022-12-22,Zelensky’s Weapons Wish List Goes Mostly Unfulfilled on Trip to Washington,"The Biden administration continues to balk at sending U.S. battle tanks, fighter jets and long-range missiles to Ukraine."
2022-12-22,Ukraine Buoyed by Hero’s Welcome for Zelensky in Washington,"Ukrainians, many left in the dark and cold by Russian airstrikes, drew solace from President Volodymyr Zelensky’s speech to Congress."
2022-12-23,Iran condemns Zelensky’s remarks to Congress as ‘baseless.’,"Iran has condemned President Volodymyr Zelensky’s remarks to the U.S. Congress, warning the Ukrainian leader against further accusing Tehran of supplying weapons to Russia for use in the war."
2022-12-23,Russian shelling hits Ukraine’s south and east as Zelensky returns to Kyiv.,"At least five civilians were killed and 18 injured in Russian attacks on Thursday and into Friday morning, an official said."
2022-12-30,Critics say a new media law signed by Zelensky could restrict press freedom in Ukraine.,"Lawmakers who passed the bill said it would help meet European Union conditions for membership, but journalists have denounced it as a move toward censorship."
2022-12-31,Putin and Zelensky will give dueling addresses today with no end to fighting in sight.,Volodymyr Zelensky of Ukraine and Vladimir V. Putin of Russia will share their New Year’s messages as the war grinds on toward its one-year anniversary.
2022-12-31,"With Speeches to Ukraine, and the World, Zelensky Shapes Narrative of the War","In nightly addresses to his people and passionate speeches to foreign leaders, the Ukrainian president has delivered a story line to rally his country, and its allies, to Ukraine’s cause."
2023-07-04,Zelensky Accuses Russia of Trying to Kill Georgia’s Former President Saakashvili,"Mikheil Saakashvili, now a Ukrainian citizen, has been imprisoned in Georgia. He appeared frail and skeletal in a court appearance that renewed concerns about his treatment in prison."
2023-07-06,Zelensky said he warned allies the counteroffensive would proceed slowly amid the wait for weapons.,"Ukraine’s president said he had wanted to start the military push sooner, in an interview with CNN."
2023-07-07,"Zelensky will discuss the grain deal with Turkey’s president, with a NATO bid in mind, too.","President Volodymyr Zelensky of Ukraine is wrapping up an intense week of diplomacy with a visit to Istanbul on Friday to meet with Turkey’s president about the Black Sea grain deal that is once again facing an uncertain future, according to Turkey’s state-run Anadolu news agency."
2023-07-07,"With Zelensky at his side, Erdogan says Ukraine ‘deserves NATO membership.’",The Turkish president also said he would work to help extend the Black Sea grain deal for longer intervals after meeting with Ukraine’s leader.
2023-07-08,"On Ukraine War’s 500th Day, Russia Strikes and Zelensky Shows Defiance","President Volodymyr Zelensky of Ukraine shared a video of a trip to Snake Island in the Black Sea, a symbol of his country’s fierce resistance, as Russian shelling in the east killed at least seven."
2023-07-13,Zelensky Leaves NATO Summit to Face Hard Realities of War,"The Ukrainian leader secured new pledges of weapons and reaffirmed security commitments from Western allies, but it was not clear how significant a boost they could provide for his country’s counteroffensive."
2023-07-15,"Russian Forces Are Doing ‘Everything They Can’ to Stop Counteroffensive, Zelensky Says","The Ukrainian leader has secured new weapons pledges, but it was not clear when the aid would arrive, or how consequential it would be on the battlefield."
2023-07-22,"As Tensions Rise, Zelensky Pushes for Way to Ship Grain Through Black Sea","The Ukrainian leader said he had spoken with the NATO chief and the Turkish president, Recep Tayyip Erdogan, a key mediator between Russia and Ukraine since the full-scale invasion began last February."
2022-03-02,I’m Writing From a Bunker With President Zelensky Beside Me. We Will Fight to the Last Breath.,Nothing less than our freedom — and yours — is at stake.
2022-03-04,‘I Want Peace.’ Zelensky’s Heroic Resistance Is an Example for the World.,Which world leaders are rising to the challenge?
2022-03-05,Zelensky criticizes NATO over its rejection of a no-fly zone.,"“All the people who will die from this day will die because of you, as well,” the Ukrainian president told NATO leaders in a video shared on social media."
2022-03-05,"Zelensky and Trump: Two Performers, One Hero",A fake tough guy versus the real deal.
2022-03-05,U.S. and Allies Discuss Security of Ukraine’s Leaders Amid Fears for Zelensky’s Safety,Concerns about the line of succession were prompted in part because President Volodymyr Zelensky insists he will not be evacuated.
2022-03-05,"Meeting with Congress, Zelensky asks for more jets and a no-fly zone.","The meeting, conducted via Zoom, was the first time President Volodymyr Zelensky of Ukraine had addressed both houses of Congress since Russia’s invasion began."
2022-03-06,"Quotation of the Day: After Zelensky’s Plea, the West Raced to Form a United Front","Quotation of the Day for Sunday, March 6, 2022."
2022-03-08,"Zelensky addressed Ukraine from his office, showing that he remained in Kyiv.",The Ukrainian president told his people that he was not afraid or in hiding.
2022-03-08,Why Zelensky Poses a Unique Threat to Putin,"As the war grinds on, Ukraine’s president is trying to reach out to Russian citizens — many of them remember him as a popular comedian."
2022-03-09,"With Humor, and a Nod to History, Johnson and Zelensky Find a Rapport","Forging an alliance with President Volodymyr Zelensky of Ukraine was a natural for Boris Johnson, Britain’s prime minister. The two share a sense of the moment."
2022-03-09,Volodymyr Zelensky Is Playing the Role of His Life,"In his TV sitcom and now at war, Ukraine’s actor-president has modeled an idea of leadership that is very different from Vladimir Putin’s."
2022-03-11,President Zelensky Makes His Case for Ukraine to the Russian People,Americans are used to wars against people who don’t so casually speak our language. Zelensky can respond to Russian propaganda by directly addressing the Russian people — in Russian.
2022-03-12,Zelensky Answers Hamlet,The Ukrainian president addresses the existential question for the world.
2022-03-14,Zelensky will address Congress in a virtual speech on Wednesday.,The Ukrainian president’s speech will likely increase growing momentum on Capitol Hill to pressure President Biden to send fighter jets to Kyiv.
2022-03-15,Zelensky calls on Russian troops to surrender.,The Ukrainian leader and the Pentagon have both said some Russian soldiers have surrendered or been captured.
2022-03-15,Zelensky’s appeal to Canada: Imagine if Toronto were Kyiv.,The Ukrainian president’s emotional speech to Canadian lawmakers underscored how he has increasingly cast himself as a spokesman for liberal democracy.
2022-03-16,Zelensky urges more leaders to visit Kyiv after a visit by prime ministers of 3 NATO nations.,"The leaders from Poland, the Czech Republic and Slovenia “fear nothing,” President Volodymyr Zelensky said, and he urged other leaders to make similar visits."
2022-03-16,Zelensky’s Emotional Appeal to Congress,"President Volodymyr Zelensky of Ukraine gave a searing speech to a joint meeting of Congress, an extraordinary address by a leader under assault by a hostile foreign power."
2022-03-16,Your Thursday Briefing: Zelensky Speaks to Congress,Plus an offshore earthquake in Japan and mass graves in Syria.
2022-03-16,Zelensky’s Plea to Congress,Biden announced $800 million in new military aid to Ukraine.
2022-03-16,Annotated Transcript: Zelensky’s Speech to Congress,President Volodymyr Zelensky of Ukraine addressed a joint meeting of the House and Senate to press his case for more aid to Ukraine amid devastating attacks by Russia.
2022-03-16,"Invoking America’s Darkest Days, Zelensky Pleads for More U.S. Aid",President Volodymyr Zelensky of Ukraine called for a no-fly zone and more weapons to combat Russia’s assault and implored President Biden to be “the leader of peace.”
2022-03-17,"Trevor Noah: Addressing Congress, Zelensky ‘Knew His Audience’","Ukraine’s president must have researched American history before his speech, said Noah (who speculated about how it “could have gone very wrong”)."
2022-03-17,Zelensky’s Powerful Plea to Congress,Readers react to President Volodymyr Zelensky’s speech and urge a no-fly zone in Ukraine. Also: Violence against Asian Americans; daylight saving time.
2022-03-19,Zelensky Pleads to Parliament for More Help. What Can Canada Offer?,The address by President Volodymyr Zelensky of Ukraine was also a reminder that Canada might indirectly benefit from the crisis.
2022-03-19,"Putin Isn’t Yet Ready for Talks With Zelensky, Turkish Official Says",Turkey is trying to mediate between Ukraine and Russia and bring an end to the war. But a senior Turkish official said that Russia was in no hurry.
2022-03-19,"While Putin Shrinks, Zelensky Soars","Tiny, tiny Trump and cruel fool Putin."
2022-03-20,It’s Now Putin’s Plan B in Ukraine vs. Biden’s and Zelensky’s Plan A,Russia’s strategic choices could become increasingly frightening to the West.
2022-03-21,"Walls, Dreams and Genocide: Zelensky’s Speeches Invoke History to Rally Support","The Ukrainian leader, a former actor, has invoked emotional moments in the history of nations from which he is hoping to secure backing. We look at five of his recent speeches."
2022-03-22,Zelensky condemns Russian attacks on protesters and children.,"‘It was a day of difficult events,’ the Ukrainian president said in a video address."
2022-03-23,Zelensky invokes memories of Fukushima and a cult’s chemical attack in his address to Japan’s Parliament.,President Volodymyr Zelensky said that Russia’s invasion could set off a nuclear catastrophe in Chernobyl and warned that Russia could use chemical weapons like the one used in a 1995 attack in Tokyo.
2022-03-23,Zelensky Doesn’t Know the End of His Story. Churchill Didn’t Either.,The pivotal and motivating power of individual charismatic leadership.
2022-03-24,Zelensky calls on NATO members to do more to help Ukraine’s military.,"In a video address to a closed-door session of the military alliance, President Volodymyr Zelensky warned that Russia “does not intend to stop in Ukraine,” according to his government’s transcript."
2022-03-25,Zelensky Wants a No-Fly Zone. NATO Is Right to Say No.,"A no-fly zone in Ukraine, meant to protect civilians, might fail to do so while  escalating the war. "
2022-03-25,"In a speech to the E.U., Zelensky singles out Hungary over sanctions.","Addressing the Hungarian leader, Viktor Orban, directly, Volodymyr Zelensky said, “You have to decide for yourself who you are with.”"
2022-03-26,"Addressing Qatar, Zelensky urges energy producers to increase their exports to Europe.","“The future of Europe rests with your efforts,” Ukraine’s leader said in a plea to help the continent wean itself off Russian fossil fuels."
2022-03-27,Zelensky renews his call for planes and tanks from NATO.,President Volodymyr Zelensky said European leaders were falling short in helping his nation fight Russia and urged them to show even a bit of the courage that the outmanned residents of Mariupol have demonstrated.
2022-03-27,"Zelensky, whose career started in show business, pressed Hollywood for an appearance at the Oscars.",The Ukrainian president was looking for support from Hollywood. But his appeal to speak during the Oscars encountered drama of its own.
2022-03-27,Zelensky Gives Interview to Russian Journalists. Moscow Orders It Quashed.,"The remarkable interview was still published by journalists outside of Russia, an episode that laid bare the extraordinary, and partly successful, efforts at censorship by Moscow."
2024-10-16,Zelensky Pitches His ‘Victory Plan’ to Ukrainian Lawmakers,"The proposal would rely heavily on increased Western assistance. So far, it has drawn a lukewarm response from Ukraine’s allies."
2024-10-17,Zelensky Tries to Sell His ‘Victory Plan’ to European Leaders,"President Volodymyr Zelensky of Ukraine made an urgent plea in Brussels, though it’s unclear to what extent the officials gathered there will go along with it."
2024-10-17,"In Rambling Interview, Trump Blames Zelensky, Not Putin, for Ukraine War","The war began when Russia invaded Ukraine, but Donald J. Trump said on a podcast that the Ukrainian president “should never have let that war start.”"
2024-10-29,"With Limited Options, Zelensky Seeks a Path Forward for Ukraine",A muted response to Ukraine’s “victory plan” and steep challenges on the battlefield leave Kyiv searching for a Plan B.
2022-04-01,"Refuse to cooperate with the Kremlin’s war, Zelensky tells Ukrainians and Russians.",President Volodymyr Zelensky of Ukraine threatened retribution for people who collaborate with occupying forces and accused retreating Russians of planting mines and even booby-trapping corpses.
2022-04-04,Volodymyr Zelensky speaks to Grammys audience in a prerecorded video.,"The Ukrainian president, Volodymyr Zelensky, made a plea for support before John Legend performed, sharing the stage with a poet and a singer from Ukraine."
2022-04-04,Zelensky blasts Merkel and Sarkozy for denying Ukraine NATO membership.,"In a video address, he said that NATO’s decision in 2008 not to give Ukraine a path to membership helped lead to atrocities by Russian forces."
2022-04-05,Zelensky vilifies Russia over atrocities: ‘They killed entire families.’,The Ukrainian president delivered one of his most forceful denunciations of the invasion in a live video speech to the United Nations Security Council on Tuesday.
2022-04-05,Your Wednesday Briefing: Zelensky Addressed the U.N.,Plus a change in Shanghai’s controversial family Covid policy and the tense build-up to the French presidential election.
2022-04-05,Zelensky Addresses the U.N.,The Ukrainian leader described war crimes he said Russian troops had committed.
2022-04-05,Zelensky Accuses Russia of Atrocities and Criticizes U.N.’s Inaction,"In a blistering address to the United Nations Security Council, Ukraine’s president asked what use the body was if it would not intervene to stop a war of aggression."
2022-04-07,"In his nightly address, Zelensky challenged allies to find the determination to ban Russian oil.",He also accused Russian troops of starting to hide evidence of civilian deaths.
2022-04-11,Zelensky says Ukraine takes ‘as seriously as possible’ an apparent threat of Russian chemical weapon use.,A Ukrainian unit in Mariupol claimed Russian forces had used chemical weapons there. Their report could not be independently confirmed.
2022-04-19,Why We Admire Zelensky,Ukraine’s president reminds us that democracies can still generate great leaders. 
2022-04-22,"Ukraine needs up to $7 billion in support per month, Zelensky says.","Ukraine has suffered $550 billion in losses from the war, President Volodymyr Zelensky told the World Bank on Thursday."
2022-04-23,"As Western Arms Pour Into Ukraine, Zelensky Promises Victory","“The day when they will be forced to leave Ukraine is approaching,” the Ukrainian president said of the Russians, in a sharp change of tone."
2022-04-24,Blinken and Austin meet in Kyiv with Zelensky.,"Secretary of State Antony J. Blinken and Defense Secretary Lloyd J. Austin III met Sunday with President Volodymyr Zelensky, the first senior U.S. officials known to have visited Ukraine since the invasion."
2022-04-25,How Zelensky Tamed Ukraine’s Fractious Politics and Stood Up to Putin,"Ukrainian politics were known for sharp-elbowed infighting. But as he defends his country against the Russian invasion, President Volodymyr Zelensky has his government presenting a unified front."
2024-02-05,Zelensky Hints at Major Shake-Up of Ukraine’s Government,"The president said a “reset” was needed to revive the struggling war effort, adding that his plans were “about the direction of the country’s leadership” and not just about replacing his top general."
2024-02-08,"Zelensky Removes His Top General, in Major Shake-Up of Ukraine Military","Gen. Valery Zaluzhny led the effort that thwarted Russia’s initial assault on Kyiv. But his troops have struggled to make progress recently, and tensions have mounted with the civilian leadership."
